contentId,title,description,location,start,source,type,currencyCode,amount,url,distance
66,Midnight Madness Sale - Davis Square's Gone CRAZY,(Buying things will never fill that hole in your soul... But it sure does get you some cool s***!)  Davis Square has gone CRAZY!  Black &...,"Somerville, MA",2007-07-19 17:00:00,Yelp,nightlife,USD,,https://www.yelp.com/events/somerville-midnight-madness-sale-davis-squares-gone-crazy?adjust_creative=q_PaZ4cbCD97EB1Hl7lnEA&utm_campaign=yelp_api_v3&utm_medium=api_v3_event_search&utm_source=q_PaZ4cbCD97EB1Hl7lnEA,0
67,Midnight Madness Shopping!,"Yeah, yeah. I know. Denim shopping. But WAIT, their WHOLE INVENTORY is on SALE. And where else can you shop at 11pm? Guys, don't think you got out of this,...","524 Commonwealth Ave, Boston, MA 02215",2007-07-19 18:00:00,Yelp,fashion,USD,,https://www.yelp.com/events/boston-midnight-madness-shopping?adjust_creative=q_PaZ4cbCD97EB1Hl7lnEA&utm_campaign=yelp_api_v3&utm_medium=api_v3_event_search&utm_source=q_PaZ4cbCD97EB1Hl7lnEA,0
68,Roxbury Film Festival,"Showings are held in a number of venues around town. The festival is dedicated to showcasing films that celebrate people of color, providing opportunity for...","465 Huntington Ave, Boston, MA 02115",2007-07-01 19:00:00,Yelp,film,USD,20,https://www.yelp.com/events/boston-roxbury-film-festival?adjust_creative=q_PaZ4cbCD97EB1Hl7lnEA&utm_campaign=yelp_api_v3&utm_medium=api_v3_event_search&utm_source=q_PaZ4cbCD97EB1Hl7lnEA,0
69,ArtsCentral: See Art in Everything Oct. 12-13,"During the second-ever ArtsCentral, Central Square's streets will come alive with art! From glass sculpture to fashion design, from theatrical performances...","581 Massachusetts Ave, Cambridge, MA 02139",1907-10-12 19:00:00,Yelp,festivals-fairs,USD,5,https://www.yelp.com/events/cambridge-artscentral-see-art-in-everything-oct-12-13?adjust_creative=q_PaZ4cbCD97EB1Hl7lnEA&utm_campaign=yelp_api_v3&utm_medium=api_v3_event_search&utm_source=q_PaZ4cbCD97EB1Hl7lnEA,0
70,80&amp;amp;#39;s Night At The Lansdowne Pub!,Join us for the ULTIMATE 80's Party at your favorite pub - The Lansdowne! Put on your neon & spandex and head down to the pub for your chance to WIN...,"9 Lansdowne St, Boston, MA 02215",2007-06-26 20:00:00,Yelp,nightlife,USD,,https://www.yelp.com/events/boston-80-and-amp-amp-39-s-night-at-the-lansdowne-pub?adjust_creative=q_PaZ4cbCD97EB1Hl7lnEA&utm_campaign=yelp_api_v3&utm_medium=api_v3_event_search&utm_source=q_PaZ4cbCD97EB1Hl7lnEA,0
