contentId,title,description,location,start,source,type,currencyCode,amount,url,distance
65,The Style Plan,"Description: The objective of The Style Plan is to clearly show the importance of having a strongly defined and consistent image. During the presentation,...","8432 Old Statesville Rd, Charlotte, NC 28269",2010-08-23 08:30:00,Yelp,fashion,USD,150,https://www.yelp.com/events/charlotte-the-style-plan?adjust_creative=q_PaZ4cbCD97EB1Hl7lnEA&utm_campaign=yelp_api_v3&utm_medium=api_v3_event_search&utm_source=q_PaZ4cbCD97EB1Hl7lnEA,0
66,Dublin Dog Foundation Benefit w/ Shaun Jones,The Dublin Dog Foundation is teaming up with Freedom Service Dogs to benefit the foundation's Operation Canine Comrades project. Comedian Shaun Jones will...,"17044 Kenton Dr, Cornelius, NC 28031",2010-08-19 19:00:00,Yelp,charities,USD,25,https://www.yelp.com/events/cornelius-dublin-dog-foundation-benefit-w-shaun-jones?adjust_creative=q_PaZ4cbCD97EB1Hl7lnEA&utm_campaign=yelp_api_v3&utm_medium=api_v3_event_search&utm_source=q_PaZ4cbCD97EB1Hl7lnEA,0
67,Charlotte Zombie Walk,The fourth annual Charlotte Zombie Walk is scheduled for FRIDAY AUGUST 20th at 8:00pm. The staging area is Phil's NYC Deli and Tavern at Tryon & 5th Streets...,"105 E 5th St, Charlotte, NC 28202",2010-08-20 20:00:00,Yelp,performing-arts,USD,,https://www.yelp.com/events/charlotte-charlotte-zombie-walk?adjust_creative=q_PaZ4cbCD97EB1Hl7lnEA&utm_campaign=yelp_api_v3&utm_medium=api_v3_event_search&utm_source=q_PaZ4cbCD97EB1Hl7lnEA,0
68,CAT5 CABLE release Party w/Kevin Focus,untz untz untz http://i12.photobucket.com/albums/a201/keviekevatl/SUGARSOCIETYMain/FlyersArtwork/CAT5Release.jpg,"300 N College St, Charlotte, NC 28202",2010-08-20 22:00:00,Yelp,nightlife,USD,5,https://www.yelp.com/events/charlotte-cat5-cable-release-party-w-kevin-focus?adjust_creative=q_PaZ4cbCD97EB1Hl7lnEA&utm_campaign=yelp_api_v3&utm_medium=api_v3_event_search&utm_source=q_PaZ4cbCD97EB1Hl7lnEA,0
69,2nd Annual Woofstock,The second annual Woofstock is coming and is brought to you by Great Dane Friends of Ruff Love and Blue Ridge Boxer Rescue! Come on out and have a great...,"1423 S Tryon St, Charlotte, NC 28203",2010-08-23 10:30:00,Yelp,charities,USD,5,https://www.yelp.com/events/charlotte-2nd-annual-woofstock?adjust_creative=q_PaZ4cbCD97EB1Hl7lnEA&utm_campaign=yelp_api_v3&utm_medium=api_v3_event_search&utm_source=q_PaZ4cbCD97EB1Hl7lnEA,0
70,UFC 118,I'll be going here for the fight! A friend of mine emailed me this: Whiskey Warehouse will be holding a UFC Fight Night in the back room where the dance...,"1221 The Plz, Charlotte, NC 28205",2010-08-28 16:00:00,Yelp,sports-active-life,USD,5,https://www.yelp.com/events/charlotte-ufc-118?adjust_creative=q_PaZ4cbCD97EB1Hl7lnEA&utm_campaign=yelp_api_v3&utm_medium=api_v3_event_search&utm_source=q_PaZ4cbCD97EB1Hl7lnEA,0
